{
  "apiVersion": "thoryn.io/examples/v1",
  "id": "simple-signin",
  "version": "3.0.0",
  "summary": "Register a public loopback OAuth client in your workspace, then sign a user up (real verification email) and in through the recipe's relying party.",
  "provision": "./provision.yaml",
  "requires": {
    "scopes": [
      "tenant:applications.write",
      "tenant:applications.read",
      "tenant:users.write",
      "tenant:users.read"
    ],
    "minCliVersion": "0.12.0"
  },
  "params": [
    {
      "name": "workspaceSlug",
      "prompt": "Standing workspace slug (the workspace your session is bound to; NOT created)",
      "validate": "^[a-z0-9]([a-z0-9-]{1,61}[a-z0-9])$"
    },
    {
      "name": "demoEmail",
      "prompt": "Email address of the demo user the provision file registers",
      "default": "demo-{{generate.slug8}}@example.com"
    },
    {
      "name": "appName",
      "prompt": "Display name for the OAuth client",
      "default": "Sign-in Example App {{generate.slug8}}"
    },
    {
      "name": "DEMO_USER_PASSWORD",
      "prompt": "Password for the demo user (feeds the provision file's passwordEnv; never stored)",
      "default": "Example-{{generate.slug8}}-Pw1!",
      "secret": true
    }
  ],
  "verify": [
    {
      "assert": "applications.get",
      "id": "{{provision.application.rp.clientId}}",
      "expect": {
        "status": "active"
      }
    }
  ],
  "assets": {
    "rp": "./apps/loopback-rp",
    "docs": "./README.md"
  }
}