{
  "apiVersion": "thoryn.io/examples/v1",
  "id": "magic-code-signin",
  "version": "3.0.0",
  "summary": "Register a public loopback OAuth client in an environment you own, enable magic-code for the sandbox, then sign in PASSWORDLESS by typing a single-use 6-digit email code.",
  "provision": "./provision.yaml",
  "requires": {
    "scopes": [
      "tenant:environments.write",
      "tenant:environments.read",
      "tenant:applications.write",
      "tenant:applications.read",
      "tenant:users.write",
      "tenant:users.read",
      "tenant:idp.write",
      "tenant:idp.read"
    ],
    "minCliVersion": "0.12.0"
  },
  "params": [
    {
      "name": "workspaceSlug",
      "prompt": "Standing workspace slug (the workspace your session is bound to; NOT created)",
      "validate": "^[a-z0-9]([a-z0-9-]{1,61}[a-z0-9])$"
    },
    {
      "name": "envSlug",
      "prompt": "Slug for the throwaway sandbox environment the provision file creates (fresh per run)",
      "default": "magic-code-{{generate.slug8}}",
      "validate": "^[a-z0-9]([a-z0-9-]{1,61}[a-z0-9])$"
    },
    {
      "name": "appName",
      "prompt": "Display name for the OAuth client",
      "default": "Magic-code Sign-in App {{generate.slug8}}"
    },
    {
      "name": "DEMO_USER_PASSWORD",
      "prompt": "Password for the demo user (feeds the provision file's passwordEnv; never stored)",
      "default": "Example-{{generate.slug8}}-Pw1!",
      "secret": true
    }
  ],
  "verify": [
    {
      "assert": "applications.get",
      "id": "{{provision.application.rp.clientId}}",
      "expect": {
        "status": "active"
      }
    }
  ],
  "assets": {
    "rp": "./apps/loopback-rp",
    "docs": "./README.md"
  }
}